{
  "$schema": "https://json-schema.org/draft/2020-12/schema",
  "$id": "https://sqlobserver.invalid/schemas/m12-supply-chain-contract.v1.schema.json",
  "title": "SqlObserver M12 supply-chain contract",
  "type": "object", "additionalProperties": false,
  "required": ["$schema", "schemaVersion", "contractId", "producerId", "artifactKind", "caseId", "environments", "requiredFacts", "factPredicates", "inputManifest", "sbomSchema", "outputFiles", "generation", "bounds"],
  "properties": {
    "$schema": { "const": "m12-supply-chain-contract.v1.schema.json" }, "schemaVersion": { "const": 1 },
    "contractId": { "const": "sqlobserver-m12-supply-chain" }, "producerId": { "const": "m12-supply-chain-harness" }, "artifactKind": { "const": "supply-chain-evidence" }, "caseId": { "const": "m12-sbom" },
    "environments": { "const": ["release-windows-server-2022", "release-windows-server-2025"] }, "requiredFacts": { "const": ["os", "architecture", "sbom"] }, "factPredicates": { "const": { "os": "windows", "architecture": "x64", "sbom": true } },
    "inputManifest": { "const": "m12-sbom-inputs.v1.json" }, "sbomSchema": { "const": "m12-sbom.v1.schema.json" }, "outputFiles": { "const": ["m12-sbom.cdx.json", "m12-sbom-test-evidence.json", "m12-sbom-provenance.json"] },
    "generation": { "type": "object", "additionalProperties": false, "required": ["format", "specVersion", "deterministic", "timestampSource", "commitSource", "runSource"], "properties": { "format": { "const": "CycloneDX" }, "specVersion": { "const": "1.7" }, "deterministic": { "const": true }, "timestampSource": { "const": "supplied" }, "commitSource": { "const": "supplied" }, "runSource": { "const": "supplied" } } },
    "bounds": { "type": "object", "additionalProperties": false, "required": ["components", "dependencyNodes", "jsonBytes", "stringLength", "depth"], "properties": { "components": { "const": 4096 }, "dependencyNodes": { "const": 8192 }, "jsonBytes": { "const": 4194304 }, "stringLength": { "const": 512 }, "depth": { "const": 32 } } }
  }
}
